<?xml version="1.0" encoding="UTF-8"?>
<xs:schema xmlns:xs="http://www.w3.org/2001/XMLSchema" elementFormDefault="qualified" attributeFormDefault="unqualified">  
 <xs:simpleType name="test1">
		<xs:restriction base="xs:string">
		  <xs:enumeration value="football"/>
		  <xs:enumeration value="volleyball"/>
		  <xs:enumeration value="basketball"/>
		</xs:restriction>
	</xs:simpleType>
  <xs:simpleType name="test2">
			<xs:restriction base="xs:integer">
			  <xs:minInclusive value="10"/>
			  <xs:maxInclusive value="25"/>
			
			</xs:restriction>
		
		</xs:simpleType>
 
	<xs:element name="family">
		<xs:complexType mixed="true">
			<xs:sequence>
				<xs:element name="grandfather">
					<xs:complexType mixed="true">
						<xs:sequence>
							<xs:element name="father" maxOccurs="2">
								<xs:complexType mixed="true">
									<xs:sequence>
										<xs:element name="mother">
											<xs:complexType>
												<xs:simpleContent>
													<xs:extension base="xs:string">
														<xs:attribute name="job" type="xs:string" use="required"/>
													</xs:extension>
												</xs:simpleContent>
											</xs:complexType>
										</xs:element>
										<xs:element name="daughter" minOccurs="1" maxOccurs="2">
											<xs:complexType>
												<xs:simpleContent>
													<xs:extension base="xs:string">
														<xs:attribute name="age" type="xs:integer"/>
														<xs:attribute name="sport" type="test1"/>
													</xs:extension>
												</xs:simpleContent>
											</xs:complexType>
										</xs:element>
										<xs:element name="son" minOccurs="1" maxOccurs="2">
											<xs:complexType>
												<xs:simpleContent>
													<xs:extension base="xs:string">
														<xs:attribute name="age" type="test2"/>
														<xs:attribute name="sport" type="xs:string"/>
													</xs:extension>
												</xs:simpleContent>
											</xs:complexType>
										</xs:element>
									</xs:sequence>
								</xs:complexType>
							</xs:element>
							<xs:element name="uncle" type="xs:string" maxOccurs="3"/>
							<xs:element name="aunt">
								<xs:complexType>
									<xs:attribute name="job" type="xs:string" fixed="doctor"/>
								</xs:complexType>
							</xs:element>
						</xs:sequence>
					</xs:complexType>
				</xs:element>
			</xs:sequence>
			<xs:attribute name="loc" type="xs:string" fixed="cairo"/>
		</xs:complexType>
	</xs:element>
</xs:schema>
